{
  "spec_version": "1.0",
  "id": "greeting",
  "version": 1,
  "description": "Return a greeting from validated input.",
  "input_schema": {
    "type": "object",
    "required": ["name"],
    "properties": {
      "name": {"type": "string", "minLength": 1, "maxLength": 100}
    },
    "additionalProperties": false
  },
  "steps": [
    {
      "id": "message",
      "action": "value",
      "input": {
        "message": {"$concat": ["Hello ", {"$ref": "/input/name"}]}
      }
    }
  ],
  "output": {"message": {"$ref": "/steps/message/message"}}
}
